{
  "canvas": { "aspect": "2366:1402" },
  "nodes": [
    { "id": "n1", "kind": "box", "bbox": [108, 99, 90, 25], "text": "MineDojo Simulator", "role": "default" },
    { "id": "n2", "kind": "box", "bbox": [76, 142, 158, 24], "text": "Unbiased Atomic Actions (uniform dist.)", "role": "default" },
    { "id": "n3", "kind": "box", "bbox": [119, 183, 54, 19], "text": "MiniCPM", "role": "default" },
    { "id": "n4", "kind": "box", "bbox": [90, 214, 138, 36], "text": "GF-Minecraft Dataset (video, keyboard K, Mouse M, Prompt P)", "role": "emphasis" },
    { "id": "n5", "kind": "box", "bbox": [395, 91, 543, 27], "text": "Backbone Feature F (intermediate latent - prompt already fused)", "role": "default" },
    { "id": "n6", "kind": "box", "bbox": [406, 159, 72, 22], "text": "Mouse Movement M", "role": "input" },
    { "id": "n7", "kind": "box", "bbox": [509, 162, 67, 19], "text": "Grouping (w=3)", "role": "default" },
    { "id": "n8", "kind": "box", "bbox": [605, 161, 54, 33], "text": "Repeat (align length)", "role": "default" },
    { "id": "n9", "kind": "box", "bbox": [692, 162, 72, 19], "text": "Concatenate with F", "role": "default" },
    { "id": "n10", "kind": "box", "bbox": [785, 150, 44, 42], "text": "MLP → Temporal Self-Attention", "role": "default" },
    { "id": "n11", "kind": "box", "bbox": [406, 216, 64, 16], "text": "Keyboard Action K", "role": "input" },
    { "id": "n12", "kind": "box", "bbox": [501, 202, 68, 28], "text": "Embed + Pos. Encoding", "role": "default" },
    { "id": "n13", "kind": "box", "bbox": [600, 212, 62, 17], "text": "Grouping (w=3)", "role": "default" },
    { "id": "n14", "kind": "box", "bbox": [705, 203, 86, 31], "text": "Cross-Attention (K=Key/Value, F=Query)", "role": "default" },
    { "id": "n15", "kind": "box", "bbox": [882, 161, 57, 19], "text": "Fused Feature", "role": "output" },
    { "id": "n16", "kind": "box", "bbox": [49, 323, 129, 35], "text": "Open-Domain Data (internet videos, no action labels)", "role": "default" },
    { "id": "n17", "kind": "box", "bbox": [238, 324, 128, 34], "text": "GF-Minecraft (action-labeled)", "role": "default" },
    { "id": "n18", "kind": "box", "bbox": [436, 325, 128, 34], "text": "GF-Minecraft (action-labeled)", "role": "default" },
    { "id": "n19", "kind": "box", "bbox": [707, 324, 132, 34], "text": "Open-Domain Prompt (new unseen scene)", "role": "default" },
    { "id": "n20", "kind": "box", "bbox": [644, 334, 52, 20], "text": "Keyboard/Mouse", "role": "default" },
    { "id": "n21", "kind": "box", "bbox": [75, 431, 75, 23], "text": "Base Model", "role": "default" },
    { "id": "n22", "kind": "box", "bbox": [264, 431, 71, 23], "text": "Base Model", "role": "default" },
    { "id": "n23", "kind": "box", "bbox": [264, 464, 71, 22], "text": "LoRA", "role": "default" },
    { "id": "n24", "kind": "box", "bbox": [466, 431, 73, 24], "text": "Base Model", "role": "default" },
    { "id": "n25", "kind": "box", "bbox": [466, 464, 73, 22], "text": "LoRA", "role": "default" },
    { "id": "n26", "kind": "box", "bbox": [466, 495, 75, 30], "text": "Action Control Module", "role": "default" },
    { "id": "n27", "kind": "box", "bbox": [736, 431, 75, 23], "text": "Base Model", "role": "default" },
    { "id": "n28", "kind": "box", "bbox": [736, 464, 75, 22], "text": "LoRA", "role": "default" },
    { "id": "n29", "kind": "box", "bbox": [738, 493, 75, 30], "text": "Action Control Module", "role": "default" },
    { "id": "n30", "kind": "box", "bbox": [870, 465, 98, 62], "text": "Output: Action-Controllable Open-Domain Game Video", "role": "emphasis" }
  ],
  "edges": [
    { "id": "e1", "from": "n1", "to": "n2", "arrow": "single", "style": "straight" },
    { "id": "e2", "from": "n2", "to": "n3", "arrow": "single", "style": "straight" },
    { "id": "e3", "from": "n3", "to": "n4", "arrow": "single", "style": "straight" },
    { "id": "e4", "from": "n5", "to": "g5", "arrow": "single", "label": "Down", "style": "straight" },
    { "id": "e5", "from": "n6", "to": "n7", "arrow": "single", "style": "straight" },
    { "id": "e6", "from": "n7", "to": "n8", "arrow": "single", "style": "straight" },
    { "id": "e7", "from": "n8", "to": "n9", "arrow": "single", "style": "straight" },
    { "id": "e8", "from": "n9", "to": "n10", "arrow": "single", "style": "straight" },
    { "id": "e9", "from": "n10", "to": "n15", "arrow": "single", "style": "straight" },
    { "id": "e10", "from": "n11", "to": "n12", "arrow": "single", "style": "straight" },
    { "id": "e11", "from": "n12", "to": "n13", "arrow": "single", "style": "straight" },
    { "id": "e12", "from": "n13", "to": "n14", "arrow": "single", "style": "straight" },
    { "id": "e13", "from": "n14", "to": "n15", "arrow": "single", "style": "elbow" },
    { "id": "e14", "from": "n15", "to": "n5", "arrow": "single", "label": "Up", "style": "straight" },
    { "id": "e15", "from": "n16", "to": "g7", "arrow": "single", "style": "straight" },
    { "id": "e16", "from": "g7", "to": "g8", "arrow": "single", "label": "copy trained model", "style": "straight" },
    { "id": "e17", "from": "n17", "to": "g8", "arrow": "single", "style": "straight" },
    { "id": "e18", "from": "g8", "to": "g9", "arrow": "single", "label": "copy trained model", "style": "straight" },
    { "id": "e19", "from": "n18", "to": "g9", "arrow": "single", "style": "straight" },
    { "id": "e20", "from": "n19", "to": "g10", "arrow": "single", "style": "straight" },
    { "id": "e21", "from": "n20", "to": "g10", "arrow": "single", "style": "elbow" },
    { "id": "e22", "from": "g10", "to": "n30", "arrow": "single", "style": "straight" }
  ],
  "containers": [
    { "id": "g1", "bbox": [8, 8, 986, 580], "title": "", "children": ["g2", "g6"], "role": "default" },
    { "id": "g2", "bbox": [26, 21, 948, 255], "title": "WHAT : Model Architecture (Structure only)", "children": ["g3", "g4"], "role": "default" },
    { "id": "g3", "bbox": [48, 62, 221, 198], "title": "Data Source : GF-Minecraft", "children": ["n1", "n2", "n3", "n4"], "role": "default" },
    { "id": "g4", "bbox": [298, 62, 672, 198], "title": "Latent Video Diffusion Transformer (VAE compression r=4)", "children": ["n5", "g5", "n15"], "role": "default" },
    { "id": "g5", "bbox": [398, 134, 462, 122], "title": "Action Control Module", "children": ["n6", "n7", "n8", "n9", "n10", "n11", "n12", "n13", "n14"], "role": "emphasis" },
    { "id": "g6", "bbox": [28, 296, 948, 264], "title": "HOW : Multi-Phase Training then Inference (Style-Action Decoupling)", "children": ["n16", "n17", "n18", "n19", "n20", "g7", "g8", "g9", "g10", "n30"], "role": "default" },
    { "id": "g7", "bbox": [50, 388, 129, 152], "title": "Phase #0 Pre-train", "children": ["n21"], "role": "phase" },
    { "id": "g8", "bbox": [238, 390, 131, 150], "title": "Phase #1 Train LoRA", "children": ["n22", "n23"], "role": "phase" },
    { "id": "g9", "bbox": [438, 393, 128, 150], "title": "Phase #2 Train Action Module", "children": ["n24", "n25", "n26"], "role": "phase" },
    { "id": "g10", "bbox": [708, 393, 132, 150], "title": "Phase #3 Inference", "children": ["n27", "n28", "n29"], "role": "phase" }
  ],
  "annotations": [
    { "id": "a1", "kind": "legend", "bbox": [878, 309, 115, 94], "items": ["Trainable (training only)", "Frozen (training only)", "Used in inference (no training)"] },
    { "id": "a2", "kind": "note", "bbox": [30, 298, 183, 15], "text": "(All phases operate on the architecture in WHAT)" },
    { "id": "a3", "kind": "note", "bbox": [413, 144, 45, 11], "text": "(Continuous)" },
    { "id": "a4", "kind": "note", "bbox": [414, 200, 42, 11], "text": "(discrete)" },
    { "id": "a5", "kind": "note", "bbox": [592, 388, 28, 12], "text": "Training" },
    { "id": "a6", "kind": "note", "bbox": [639, 388, 30, 12], "text": "Inference" },
    { "id": "a7", "kind": "note", "bbox": [268, 523, 65, 13], "text": "LoRA plugged in" },
    { "id": "a8", "kind": "note", "bbox": [748, 528, 53, 12], "text": "LoRA Removed" }
  ]
}
