{
  "canvas": { "aspect": "1885:1376" },
  "nodes": [
    {
      "id": "n1",
      "kind": "box",
      "bbox": [792, 22, 169, 134],
      "text": "Data Set",
      "role": "default"
    },
    {
      "id": "n2",
      "kind": "placeholder",
      "bbox": [333, 11, 141, 34],
      "text": "{(o_t, a_t, r_t)_{t=k}^{L+k}}_{i=1}^{B}",
      "role": "default",
      "placeholder_kind": "equation"
    },
    {
      "id": "n3",
      "kind": "box",
      "bbox": [265, 153, 183, 24],
      "text": "Loss 계산 (latent overshooting)",
      "role": "default"
    },
    {
      "id": "n4",
      "kind": "box",
      "bbox": [256, 218, 65, 20],
      "text": "θ 업데이트",
      "role": "default"
    },
    {
      "id": "n5",
      "kind": "placeholder",
      "bbox": [353, 183, 233, 77],
      "text": "",
      "role": "default",
      "placeholder_kind": "equation"
    },
    {
      "id": "n6",
      "kind": "placeholder",
      "bbox": [589, 141, 159, 133],
      "text": "(c) Recurrent state-space model (RSSM)",
      "role": "default",
      "placeholder_kind": "icon"
    },
    {
      "id": "n7",
      "kind": "box",
      "bbox": [66, 546, 32, 32],
      "text": "o₁",
      "role": "default"
    },
    {
      "id": "n8",
      "kind": "box",
      "bbox": [168, 497, 113, 77],
      "text": "Encoder\nq(s_t | o_≤t, a_<t)",
      "role": "default"
    },
    {
      "id": "n9",
      "kind": "box",
      "bbox": [322, 497, 153, 81],
      "text": "Planner\na_t = Planner(s_t, p)",
      "role": "default"
    },
    {
      "id": "n10",
      "kind": "box",
      "bbox": [509, 481, 127, 126],
      "text": "action repeat\n환경이랑 상호작용해서\nr_t^k, o_{t+1}^k 구하기\na_t R번 반복",
      "role": "default"
    },
    {
      "id": "n11",
      "kind": "box",
      "bbox": [659, 530, 159, 61],
      "text": "r_t, o_{t+1} ← Σ_{k=1}^{R} r_t^k, o_{t+1}^R",
      "role": "default"
    },
    {
      "id": "n12",
      "kind": "box",
      "bbox": [863, 507, 86, 28],
      "text": "{(o_t, a_t, r_t)_{t=1}^{T}}",
      "role": "emphasis"
    },
    {
      "id": "n13",
      "kind": "box",
      "bbox": [293, 586, 111, 17],
      "text": "transition, reward model",
      "role": "input"
    },
    {
      "id": "n14",
      "kind": "box",
      "bbox": [273, 614, 205, 18],
      "text": "Add exploration noise ε ~ p(ε) to the action",
      "role": "default"
    }
  ],
  "edges": [
    {
      "id": "e1",
      "from": "n1",
      "to": "g1",
      "arrow": "single",
      "label": "C번 반복",
      "style": "elbow"
    },
    {
      "id": "e2",
      "from": "n3",
      "to": "n4",
      "arrow": "single",
      "style": "straight"
    },
    {
      "id": "e3",
      "from": "n7",
      "to": "n8",
      "arrow": "single",
      "style": "straight"
    },
    {
      "id": "e4",
      "from": "n8",
      "to": "n9",
      "arrow": "single",
      "label": "s_t",
      "style": "straight"
    },
    {
      "id": "e5",
      "from": "n9",
      "to": "n10",
      "arrow": "single",
      "label": "a_t",
      "style": "straight"
    },
    {
      "id": "e6",
      "from": "n10",
      "to": "n11",
      "arrow": "single",
      "style": "straight"
    },
    {
      "id": "e7",
      "from": "n11",
      "to": "n12",
      "arrow": "single",
      "style": "straight"
    },
    {
      "id": "e8",
      "from": "n12",
      "to": "n1",
      "arrow": "single",
      "style": "straight"
    },
    {
      "id": "e9",
      "from": "n11",
      "to": "n8",
      "arrow": "single",
      "label": "Loop t=1 ... ⌈T/R⌉",
      "style": "elbow"
    },
    {
      "id": "e10",
      "from": "n13",
      "to": "n9",
      "arrow": "single",
      "style": "straight"
    },
    {
      "id": "e11",
      "from": "n14",
      "to": "n10",
      "arrow": "single",
      "style": "straight"
    }
  ],
  "containers": [
    {
      "id": "g1",
      "bbox": [40, 109, 727, 168],
      "title": "1. Model fitting (World model 3종)",
      "children": ["n3", "n4", "n5", "n6"],
      "role": "default"
    },
    {
      "id": "g2",
      "bbox": [39, 327, 921, 384],
      "title": "2. Data Collection",
      "children": ["g3", "n7", "n12", "n13", "n14"],
      "role": "default"
    },
    {
      "id": "g3",
      "bbox": [158, 399, 691, 285],
      "title": "",
      "children": ["n8", "n9", "n10", "n11"],
      "role": "default"
    }
  ],
  "annotations": [
    {
      "id": "a1",
      "kind": "note",
      "bbox": [582, 116, 163, 23],
      "text": "RSSM 구현되는 안정적 학습"
    },
    {
      "id": "a2",
      "kind": "note",
      "bbox": [249, 245, 88, 16],
      "text": "model 3개 업데이트"
    },
    {
      "id": "a3",
      "kind": "note",
      "bbox": [369, 472, 26, 12],
      "text": "CEM"
    },
    {
      "id": "a4",
      "kind": "note",
      "bbox": [468, 467, 26, 12],
      "text": "MPC"
    },
    {
      "id": "a5",
      "kind": "note",
      "bbox": [698, 505, 101, 23],
      "text": "1,t 까지의 누적합"
    }
  ]
}
